{ "name": "Himanshu Kumar Pathak", 
"country": "India", 
"role": "AI/ML Engineer", 
"github": "https://github.com/CHimPat073", 
"linkedin": "https://linkedin.com/in/himanshu-kumar-pathak-0b74052a0", 
"highlight": "Learining and exploring the field of AI/ML, with a strong interest in developing innovative solutions using machine learning algorithms and data analysis techniques. Passionate about contributing to open-source projects and collaborating with like-minded individuals to create impactful AI applications." 
}