{
  "name": "Ashwin Chinta",
  "country": "India",
  "role": "Developer",
  "github": "https://github.com/ashmsd7",
  "linkedin": "https://linkedin.com/in/ashwin-chinta-b92b2228a",
  "highlight": "I am a passionate developer learning to build new, meaningful projects that can help bring a change. Trying out open source with this and looking forward to contributing more in the near future."
}
