{
  "name": "Varun",
  "country": "India",
  "role": "SDET Intern",
  "github": "https://github.com/varun222004",
  "linkedin": "https://www.linkedin.com/in/varun-v-3448a6259",
  "highlight": "SDET Intern and B.Tech IT graduate passionate about Full Stack Development, React, Flutter, and Quality Assurance."
}
