{
  "name": "Sameer Kumar Singh",
  "country": "India",
  "role": "Software Engineer",
  "github": "https://github.com/hotshot0104",
  "linkedin": "https://www.linkedin.com/in/sameer-singh-8a1b90342/",
  "highlight": "I am a software engineer with a passion for building innovative solutions and contributing to open-source projects. I enjoy collaborating with other developers and sharing my knowledge through blogging and speaking at tech conferences."
}