{
  "name": "Shantanu Kaushik",
  "country": "India",
  "role": "Student",
  "github": "https://github.com/stranger-048",
  "linkedin": "https://www.linkedin.com/in/shantanu-kaushik-8014a3382",
  "highlight": "I'm just trying to learn and contribute to open source projects. I have a keen interest in web development and machine learning."
}
