{ "name": "Pankhudi Roy", 
  "country": "India", 
  "role": "Full Stack Developer", 
  "github": "https://github.com/pankhudiroy", 
  "linkedin": "https://www.linkedin.com/in/pankhuri-kumari-844a422a0/", 
  "highlight": "I am a 3rd-year B.Tech student and a full-stack developer. This is my first open-source contribution, and I am excited to keep learning new things, improving myself, and gaining real-world project experience through collaboration." 
}