{
  "name": "Srimanikanta",
  "country": "India",
  "role": "Aspiring Full-Stack Developer",
  "github": "https://github.com/Srimanikanta2006",
  "linkedin": "https://www.linkedin.com/in/srimanikanta-pothu/",
  "highlight": "Built crazy projects projects like Kannada-Sentiment-Analysis, KNN and CNN based Handwritten Digit Recognition, and many more. Always eager and enjoying the process."
}
