{
  "name": "Reeya Sharma",
  "country": "India",
  "role": "Aspiring Web Developer & AI Enthusiast",
  "github": "https://github.com/Reeya0409",
  "linkedin": "https://www.linkedin.com/in/reeyaasharma494/",
  "highlight": "Building projects, learning continuously, and turning ideas into reality."
}
