{
  "name": "Saptarath ACharjee",
  "country": "India",
  "role": "Developer",
  "github": "https://github.com/sapta0069",
  "linkedin": "https://linkedin.com/in/saptarath07",
  "highlight": "I am a software developer working in Deloitte and keen to contribute to open source . Happy coding"
}