{
  "name": "Harshit Singh",
  "country": "India",
  "role": "Software Developer",
  "github": "https://github.com/harshit8786",
  "linkedin": "https://www.linkedin.com/in/harshit-singh-408799292/",
  "highlight": "I build full-stack projects, contribute to open source, and continuously sharpen my problem-solving skills."
}