{
    "name": "Sayyed Maroof ",
    "country": "India",
    "role": "Full Stack Developer",
    "github": "https://github.com/sayyedmaroof",
    "linkedin": "https://www.linkedin.com/in/sayyedmaroof",
    "highlight": "Build scalable backends and user-friendly frontends with a focus on performance and security."
}