{
  "name": "Vidheendu Chaturvedi",
  "country": "India",
  "role": "Data Scientist",
  "github": "https://github.com/Vidheendu",
  "linkedin": "https://www.linkedin.com/in/vidheendu-chaturvedi-b0b362351/",
  "highlight": "I’m constantly pushing myself to learn, adapt, and grow as a full-stack developer by building real-world projects and exploring new technologies."
}