{
  "name": "Aqsa Ali Raza Jamali",
  "country": "Pakistan",
  "role": "Full-Stack Developer",
  "github": " https://github.com/aqsaalirazajamali",
  "linkedin": " https://www.linkedin.com/in/aqsa-ali-raza-4385a7351",
  "highlight": "I'm a Full-Stack Developer passionate about AI-powered software development, modern web technologies, and cybersecurity. I build full-stack applications using Python, JavaScript/TypeScript, React, Node.js, FastAPI, and large language models while continuously expanding my skills in AI agents and cyber defense."
}