{
  "name": "Amisha Patel",
  "country": "India",
  "role": "Data Science Student at NIAT",
  "github": "https://github.com/AmishaOnMain",
  "linkedin": "www.linkedin.com/in/amisha-patel-481917376",
  "highlight": "A first-year CSE student passionate about full-stack development, open source, and lifelong learning."
}
