{
  "name": "Muhammad Iftikhar",
  "country": "Pakistan",
  "role": "AI Engineer & Founder @ ZyrogX",
  "github": "https://github.com/zyrogX",
  "linkedin": "https://linkedin.com/in/zyrog",
  "highlight": "Built Hifzo AI: A WhatsApp RAG assistant that turns unstructured voice notes into a structured medical & expense database."
}
