{
  "name": "lakaThabrew",
  "country": "Sri Lanka",
  "role": "Undergraduate",
  "github": "https://github.com/lakaThabrew",
  "linkedin": "https://www.linkedin.com/in/lakmana-Thabrew/",
  "highlight": "I am Undergraduate and I am trying to contribute on Open source projects. I am a beginner in open source and I am trying to learn more about it. I am also trying to contribute to the open source community."
}