{
  "name": "A S Swan",
  "country": "India",
  "role": "Fullstack Developer",
  "github": "https://github.com/SwanSkynet",
  "linkedin": "https://www.linkedin.com/in/swanathiyarath",
  "highlight": "Software Engineer building production systems that scale, perform, and ship fast. Checkout my profile at https://swanathiyarath.com"
}
