{
  "name": "Ali Hallak",
  "country": "Syria",
  "role": "Software Engineer",
  "github": "https://github.com/ali1halak",
  "linkedin": "https://www.linkedin.com/in/alihallak1/",
  "highlight": "I am a software engineer with a passion for building innovative solutions and contributing to open-source projects. I enjoy collaborating with other developers and sharing my knowledge through blogging and speaking at tech conferences."
}