{
    "name": "Odari K. Charles",
    "country": "Kenya",
    "role": "Engineering Student",
    "github": "https://github.com/ODARI-CHARLES1",
    "linkedin": "www.linkedin.com/in/odari-kibisi-charles-329b19331",
    "highlight": "Electrical and Electronics Engineering student focused on end-to-end systems integrating hardware, firmware, AI, and backend software. My work includes IoT systems, robotics, embedded development, engineering simulations, and intelligent systems, supported by mathematics and computational modeling."
}