{
  "name": "Sumit Dongare",
  "country": "India",
  "role": "Aspiring Data Scientist & AI/ML",
  "github": "https://github.com/Sumiiit84",
  "linkedin": "www.linkedin.com/in/sumit-dongare-695a06330",
  "highlight": "Building projects, learning continuously, and turning ideas into reality."
}