{
  "name": "Ketan Mandave",
  "country": "India",
  "role": "Full Stack Developer",
  "github": "https://github.com/ketanmandave",
  "linkedin": "https://www.linkedin.com/in/ketan-mandave-a99862291/",
  "highlight": "I am a MERN stack developer currently exploring Data Science with Python."
}