{
  "name": "Gaurav Shirsath",
  "country": "India",
  "role": "B.Tech Computer Engineering Student",
  "github": "https://github.com/MrGaurav695",
  "linkedin": "https://www.linkedin.com/in/gaurav-shirsath/",
  "highlight": "I build practical projects, explore AI/ML, and continuously improve my development skills"
}