{
  "name": "Lukman",
  "country": "Indonesia",
  "role": "Full-Stack Engineer & Project Manager",
  "github": "https://github.com/lukman-ss",
  "linkedin": "https://linkedin.com/in/lukamanss",
  "highlight": "Built an experimentation-first engineering lab covering Postgres replication (sync/async), Go Buffalo APIs, self-hosted DevOps stacks, and applied computer vision pipelines (YOLO-based counting/segmentation)."
}